{
  "$schema": "https://json-schema.org/draft/2020-12/schema",
  "title": "HTTP source capability profile",
  "type": "object",
  "additionalProperties": false,
  "required": ["schema_version", "id", "dataset", "fields", "capabilities"],
  "properties": {
    "schema_version": { "const": "1.0.0" },
    "id": { "type": "string", "pattern": "^[a-z0-9][a-z0-9._-]+$" },
    "dataset": { "type": "string" },
    "description": { "type": "string" },
    "fields": { "type": "array", "items": { "type": "string" }, "uniqueItems": true },
    "capabilities": {
      "type": "array",
      "items": { "type": "string", "pattern": "^[a-z][a-z0-9_]*$" },
      "uniqueItems": true
    }
  }
}
