{
  "schema_version": "1.0.0",
  "id": "multisource-full-http",
  "dataset": "normalized.http",
  "description": "Reference profile for the full normalized HTTP vocabulary, including parsed uploads, JSON, GraphQL and JWT. This is a capability ceiling, not an automatic advertisement for any existing adapter. Advertise only guarantees the adapter actually supplies.",
  "fields": [
    "aisecuritycustomtopiccategories",
    "aisecurityinjectionscore",
    "aisecuritypiicategories",
    "aisecuritytokencount",
    "aisecurityunsafetopiccategories",
    "botdetectionids",
    "botdetectiontags",
    "botscore",
    "botscoresrc",
    "bottags",
    "cachecachestatus",
    "cachelockwaitedms",
    "cachereserveused",
    "cacheresponsebytes",
    "cacheresponsestatus",
    "cachetieredfill",
    "clientasn",
    "clientcity",
    "clientcountry",
    "clientdevicetype",
    "clientip",
    "clientipclass",
    "clientlatitude",
    "clientlongitude",
    "clientmtlsauthcertfingerprint",
    "clientmtlsauthstatus",
    "clientregioncode",
    "clientrequestbytes",
    "clientrequesthost",
    "clientrequestmethod",
    "clientrequestpath",
    "clientrequestprotocol",
    "clientrequestreferer",
    "clientrequestscheme",
    "clientrequestsource",
    "clientrequesturi",
    "clientrequestuseragent",
    "clientsrcport",
    "clientsslcipher",
    "clientsslprotocol",
    "clienttcprttms",
    "clienttlskeyexchangegroup",
    "clientxrequestedwith",
    "contentscanobjresults",
    "contentscanobjsizes",
    "contentscanobjtypes",
    "cookies",
    "destinationport",
    "edgecfconnectingo2o",
    "edgecolocode",
    "edgecoloid",
    "edgeendtimestamp",
    "edgepathingop",
    "edgepathingsrc",
    "edgepathingstatus",
    "edgeratelimitaction",
    "edgeratelimitid",
    "edgerequesthost",
    "edgeresponsebodybytes",
    "edgeresponsebytes",
    "edgeresponsecompressionratio",
    "edgeresponsecontenttype",
    "edgeresponsestatus",
    "edgeserverip",
    "edgestarttimestamp",
    "edgetimetofirstbytems",
    "firewallforaiinjectionscore",
    "firewallforaipiicategories",
    "firewallforaitokencount",
    "firewallforaiunsafetopiccategories",
    "firewallmatchesactions",
    "firewallmatchesruleids",
    "firewallmatchessources",
    "fraudattack",
    "frauddetectionids",
    "frauddetectiontags",
    "fraudemailrisk",
    "frauduserid",
    "graphqlaliascount",
    "graphqlbatchsize",
    "graphqlfieldnames",
    "graphqlmaxdepth",
    "ja3hash",
    "ja4",
    "ja4signals",
    "jsdetectionpassed",
    "jwtalgorithm",
    "jwtkeyid",
    "leakedcredentialcheckresult",
    "matchedrules",
    "multipartcharsets",
    "multipartpartheaders",
    "origindnsresponsetimems",
    "originip",
    "originrequestheadersenddurationms",
    "originresponsebytes",
    "originresponsedurationms",
    "originresponseheaderreceivedurationms",
    "originresponsehttpexpires",
    "originresponsehttplastmodified",
    "originresponsestatus",
    "originresponsetime",
    "originsslprotocol",
    "origintcphandshakedurationms",
    "origintlshandshakedurationms",
    "parentrayid",
    "paypercrawlstatus",
    "rayid",
    "requestbody",
    "requestheaders",
    "requestheadersraw",
    "requestid",
    "requestjsonpaths",
    "responsebody",
    "responseheaders",
    "responseheadersraw",
    "securityaction",
    "securityactions",
    "securitylevel",
    "securityruledescription",
    "securityruleid",
    "securityruleids",
    "securitysources",
    "smartroutecoloid",
    "subrequests",
    "uploadedfilecontents",
    "uploadedfilenames",
    "uppertiercoloid",
    "verifiedbotcategory",
    "wafaction",
    "wafattackscore",
    "wafflags",
    "wafmatchedvar",
    "wafprofile",
    "wafrceattackscore",
    "wafruleid",
    "wafrulemessage",
    "wafsqliattackscore",
    "wafxssattackscore",
    "webassetslabelsmanaged",
    "webassetsoperationid",
    "workercputime",
    "workerscriptname",
    "workerstatus",
    "workersubrequest",
    "workersubrequestcount",
    "workerwalltimeus",
    "zoneid",
    "zonename"
  ],
  "capabilities": [
    "cloudflare_security_actions",
    "cloudflare_waf_scores",
    "destination_port",
    "event_time",
    "file_upload_content",
    "file_upload_metadata",
    "graphql_ast",
    "graphql_batch",
    "multipart_metadata",
    "parsed_cookies",
    "parsed_json_body",
    "parsed_jwt",
    "raw_request_headers",
    "raw_response_headers",
    "request_body",
    "request_header_values",
    "response_body",
    "response_header_values",
    "stateful_aggregation"
  ]
}
